{
  "$schema": "https://json-schema.org/draft/2020-12/schema",
  "$id": "https://dopejs.dev/schemas/platform-probe-report-v1.json",
  "title": "doper platform probe report",
  "type": "object",
  "additionalProperties": false,
  "required": ["build", "deviceId", "runId", "version"],
  "properties": {
    "build": {
      "type": "object",
      "additionalProperties": false,
      "required": ["id", "mode"],
      "properties": {
        "id": { "type": "string", "minLength": 1 },
        "mode": { "type": "string", "minLength": 1 }
      }
    },
    "canvas": {
      "type": "object",
      "additionalProperties": false,
      "properties": {
        "mainThread": { "$ref": "#/$defs/canvasResult" },
        "worker": { "$ref": "#/$defs/canvasResult" }
      }
    },
    "collection": { "$ref": "#/$defs/collection" },
    "deviceId": { "type": "string", "minLength": 1 },
    "editing": { "$ref": "#/$defs/editingSnapshot" },
    "environment": { "$ref": "#/$defs/environment" },
    "errors": {
      "type": "object",
      "additionalProperties": { "type": "string", "minLength": 1 }
    },
    "finishedAt": { "type": "string", "format": "date-time" },
    "messageBackpressure": { "$ref": "#/$defs/messageBackpressureResult" },
    "runId": { "type": "string", "format": "uuid" },
    "sabBackpressure": { "$ref": "#/$defs/sabBackpressureResult" },
    "sabLatency": { "$ref": "#/$defs/timingResult" },
    "selfDrive": { "$ref": "#/$defs/timingResult" },
    "startedAt": { "type": "string", "format": "date-time" },
    "transport": { "$ref": "#/$defs/transportMatrix" },
    "version": { "const": 1 },
    "wasm": { "$ref": "#/$defs/wasmResult" },
    "wasmBudget": { "$ref": "#/$defs/wasmBudgetResult" },
    "workerRaf": { "$ref": "#/$defs/timingResult" }
  },
  "$defs": {
    "collection": {
      "oneOf": [
        {
          "type": "object",
          "additionalProperties": false,
          "required": ["kind"],
          "properties": { "kind": { "const": "single" } }
        },
        {
          "type": "object",
          "additionalProperties": false,
          "required": ["batchId", "kind", "sequence", "total"],
          "properties": {
            "batchId": { "type": "string", "format": "uuid" },
            "kind": { "enum": ["sample", "warmup"] },
            "sequence": { "type": "integer", "minimum": 1 },
            "total": { "type": "integer", "minimum": 1 }
          }
        }
      ]
    },
    "canvasResult": {
      "type": "object",
      "additionalProperties": false,
      "required": [
        "durationMs",
        "operations",
        "operationsPerSecond",
        "scrollCopyOperations",
        "scrollCopyOperationsPerSecond",
        "tileSizes"
      ],
      "properties": {
        "durationMs": { "type": "number", "minimum": 0 },
        "operations": { "type": "integer", "minimum": 0 },
        "operationsPerSecond": { "type": "number", "minimum": 0 },
        "scrollCopyOperations": { "type": "integer", "minimum": 0 },
        "scrollCopyOperationsPerSecond": { "type": "number", "minimum": 0 },
        "tileSizes": {
          "type": "array",
          "minItems": 4,
          "items": {
            "type": "object",
            "additionalProperties": false,
            "required": ["megapixelsPerSecond", "operations", "operationsPerSecond", "tileSizePx"],
            "properties": {
              "megapixelsPerSecond": { "type": "number", "minimum": 0 },
              "operations": { "type": "integer", "minimum": 0 },
              "operationsPerSecond": { "type": "number", "minimum": 0 },
              "tileSizePx": { "type": "integer", "minimum": 1 }
            }
          }
        }
      }
    },
    "editingSnapshot": {
      "type": "object",
      "additionalProperties": false,
      "required": [
        "composing",
        "droppedRecords",
        "events",
        "initialText",
        "initialVisualViewportHeight",
        "mode",
        "recordingVersion",
        "records",
        "selectionEnd",
        "selectionStart",
        "text"
      ],
      "properties": {
        "composing": { "type": "boolean" },
        "droppedRecords": { "type": "integer", "minimum": 0 },
        "events": { "type": "array", "items": { "type": "string" } },
        "initialText": { "type": "string" },
        "initialVisualViewportHeight": { "type": "number", "minimum": 0 },
        "mode": { "enum": ["edit-context", "textarea-proxy"] },
        "recordingVersion": { "const": 1 },
        "records": {
          "type": "array",
          "maxItems": 512,
          "items": { "$ref": "#/$defs/editingEventRecord" }
        },
        "selectionEnd": { "type": "integer", "minimum": 0 },
        "selectionStart": { "type": "integer", "minimum": 0 },
        "text": { "type": "string" }
      }
    },
    "editingEventRecord": {
      "type": "object",
      "additionalProperties": false,
      "required": [
        "atMs",
        "composing",
        "data",
        "event",
        "message",
        "selectionEnd",
        "selectionStart",
        "text"
      ],
      "properties": {
        "atMs": { "type": "number", "minimum": 0 },
        "composing": { "type": "boolean" },
        "data": {
          "type": "object",
          "additionalProperties": {
            "anyOf": [
              { "type": "boolean" },
              { "type": "number" },
              { "type": "string" },
              { "type": "null" }
            ]
          }
        },
        "event": { "type": "string", "minLength": 1 },
        "message": { "type": "string", "minLength": 1 },
        "selectionEnd": { "type": "integer", "minimum": 0 },
        "selectionStart": { "type": "integer", "minimum": 0 },
        "text": { "type": "string" }
      }
    },
    "environment": {
      "type": "object",
      "additionalProperties": false,
      "required": [
        "crossOriginIsolated",
        "deviceMemoryGiB",
        "devicePixelRatio",
        "editContext",
        "hardwareConcurrency",
        "offscreenCanvas",
        "sharedArrayBuffer",
        "timeOrigin",
        "userAgent",
        "viewport",
        "worker"
      ],
      "properties": {
        "crossOriginIsolated": { "type": "boolean" },
        "deviceMemoryGiB": { "type": ["number", "null"], "minimum": 0 },
        "devicePixelRatio": { "type": "number", "exclusiveMinimum": 0 },
        "editContext": { "type": "boolean" },
        "hardwareConcurrency": { "type": "integer", "minimum": 1 },
        "offscreenCanvas": { "type": "boolean" },
        "sharedArrayBuffer": { "type": "boolean" },
        "timeOrigin": { "type": "number", "minimum": 0 },
        "userAgent": { "type": "string" },
        "viewport": {
          "type": "object",
          "additionalProperties": false,
          "required": ["height", "width"],
          "properties": {
            "height": { "type": "integer", "minimum": 0 },
            "width": { "type": "integer", "minimum": 0 }
          }
        },
        "worker": {
          "type": "object",
          "additionalProperties": false,
          "required": ["offscreenCanvas", "requestAnimationFrame", "sharedArrayBuffer"],
          "properties": {
            "offscreenCanvas": { "type": "boolean" },
            "requestAnimationFrame": { "type": "boolean" },
            "sharedArrayBuffer": { "type": "boolean" }
          }
        }
      }
    },
    "sampleSummary": {
      "type": "object",
      "additionalProperties": false,
      "required": ["count", "max", "mean", "min", "p50", "p95", "p99"],
      "properties": {
        "count": { "type": "integer", "minimum": 1 },
        "max": { "type": "number" },
        "mean": { "type": "number" },
        "min": { "type": "number" },
        "p50": { "type": "number" },
        "p95": { "type": "number" },
        "p99": { "type": "number" }
      }
    },
    "timingResult": {
      "type": "object",
      "additionalProperties": false,
      "required": ["durationMs", "samples", "summary"],
      "properties": {
        "durationMs": { "type": "number", "minimum": 0 },
        "samples": { "type": "array", "minItems": 1, "items": { "type": "number" } },
        "summary": { "$ref": "#/$defs/sampleSummary" }
      }
    },
    "messageBackpressureResult": {
      "type": "object",
      "additionalProperties": false,
      "required": [
        "acceptedCount",
        "acceptedPerSecond",
        "acknowledgementsMatch",
        "acknowledgedCount",
        "acknowledgedSequences",
        "backpressureHandled",
        "capacity",
        "consumedCount",
        "consumedSequences",
        "drained",
        "droppedCount",
        "durationMs",
        "finalInFlight",
        "highWatermark",
        "latestAcceptedSequence",
        "latestAcknowledgedSequence",
        "latestConsumedSequence",
        "producedCount",
        "sequenceMonotonic"
      ],
      "properties": {
        "acceptedCount": { "type": "integer", "minimum": 0 },
        "acceptedPerSecond": { "type": "number", "minimum": 0 },
        "acknowledgementsMatch": { "type": "boolean" },
        "acknowledgedCount": { "type": "integer", "minimum": 0 },
        "acknowledgedSequences": {
          "type": "array",
          "maxItems": 1000000,
          "items": { "type": "integer", "minimum": 1, "maximum": 2147483647 }
        },
        "backpressureHandled": { "type": "boolean" },
        "capacity": { "type": "integer", "minimum": 2, "maximum": 4096 },
        "consumedCount": { "type": "integer", "minimum": 0 },
        "consumedSequences": {
          "type": "array",
          "maxItems": 1000000,
          "items": { "type": "integer", "minimum": 1, "maximum": 2147483647 }
        },
        "drained": { "type": "boolean" },
        "droppedCount": { "type": "integer", "minimum": 0 },
        "durationMs": { "type": "number", "minimum": 0 },
        "finalInFlight": { "type": "integer", "minimum": 0 },
        "highWatermark": { "type": "integer", "minimum": 0 },
        "latestAcceptedSequence": { "type": "integer", "minimum": 0 },
        "latestAcknowledgedSequence": { "type": "integer", "minimum": 0 },
        "latestConsumedSequence": { "type": "integer", "minimum": 0 },
        "producedCount": { "type": "integer", "minimum": 1 },
        "sequenceMonotonic": { "type": "boolean" }
      }
    },
    "sabBackpressureResult": {
      "type": "object",
      "additionalProperties": false,
      "required": [
        "acceptedCount",
        "acceptedPerSecond",
        "backpressureHandled",
        "capacity",
        "consumedCount",
        "consumedSequences",
        "drained",
        "droppedCount",
        "durationMs",
        "finalReadCursor",
        "finalWriteCursor",
        "highWatermark",
        "latestAcceptedSequence",
        "latestConsumedSequence",
        "producedCount",
        "sequenceMonotonic"
      ],
      "properties": {
        "acceptedCount": { "type": "integer", "minimum": 0 },
        "acceptedPerSecond": { "type": "number", "minimum": 0 },
        "backpressureHandled": { "type": "boolean" },
        "capacity": { "type": "integer", "minimum": 2, "maximum": 4096 },
        "consumedCount": { "type": "integer", "minimum": 0 },
        "consumedSequences": {
          "type": "array",
          "maxItems": 1000000,
          "items": { "type": "integer", "minimum": 1, "maximum": 2147483647 }
        },
        "drained": { "type": "boolean" },
        "droppedCount": { "type": "integer", "minimum": 0 },
        "durationMs": { "type": "number", "minimum": 0 },
        "finalReadCursor": { "type": "integer", "minimum": 0 },
        "finalWriteCursor": { "type": "integer", "minimum": 0 },
        "highWatermark": { "type": "integer", "minimum": 0 },
        "latestAcceptedSequence": { "type": "integer", "minimum": 0 },
        "latestConsumedSequence": { "type": "integer", "minimum": 0 },
        "producedCount": { "type": "integer", "minimum": 1 },
        "sequenceMonotonic": { "type": "boolean" }
      }
    },
    "frameContinuityResult": {
      "type": "object",
      "additionalProperties": false,
      "required": [
        "anchorLatencySamples",
        "continuousDuringStall",
        "durationMs",
        "finalPixelRgba",
        "frameIntervals",
        "frameSummary",
        "framesDuringStall",
        "maxFrameGapMs",
        "missedFrameBudget",
        "mode",
        "paintOperations",
        "phaseErrorSamples",
        "renderedFrames"
      ],
      "properties": {
        "anchorLatencySamples": { "type": "array", "items": { "type": "number" } },
        "anchorLatencySummary": { "$ref": "#/$defs/sampleSummary" },
        "continuousDuringStall": { "type": "boolean" },
        "durationMs": { "type": "number", "minimum": 0 },
        "finalPixelRgba": {
          "type": "array",
          "minItems": 4,
          "maxItems": 4,
          "items": { "type": "integer", "minimum": 0, "maximum": 255 }
        },
        "frameIntervals": {
          "type": "array",
          "minItems": 1,
          "items": { "type": "number", "minimum": 0 }
        },
        "frameSummary": { "$ref": "#/$defs/sampleSummary" },
        "framesDuringStall": { "type": "integer", "minimum": 0 },
        "maxFrameGapMs": { "type": "number", "minimum": 0 },
        "missedFrameBudget": { "type": "integer", "minimum": 0 },
        "mode": { "enum": ["sab", "post-message", "main-thread"] },
        "paintOperations": { "type": "integer", "minimum": 0 },
        "phaseErrorSamples": { "type": "array", "items": { "type": "number" } },
        "phaseErrorSummary": { "$ref": "#/$defs/sampleSummary" },
        "renderedFrames": { "type": "integer", "minimum": 2 }
      }
    },
    "transportOutcome": {
      "oneOf": [
        {
          "type": "object",
          "additionalProperties": false,
          "required": ["status", "result"],
          "properties": {
            "status": { "const": "ok" },
            "result": { "$ref": "#/$defs/frameContinuityResult" }
          }
        },
        {
          "type": "object",
          "additionalProperties": false,
          "required": ["status", "reason"],
          "properties": {
            "status": { "enum": ["unsupported", "error"] },
            "reason": { "type": "string", "minLength": 1 }
          }
        }
      ]
    },
    "transportMatrix": {
      "type": "object",
      "additionalProperties": false,
      "required": ["modes", "recommendedMode"],
      "properties": {
        "recommendedMode": { "enum": ["sab", "post-message", "main-thread"] },
        "modes": {
          "type": "object",
          "additionalProperties": false,
          "required": ["sab", "post-message", "main-thread"],
          "properties": {
            "sab": { "$ref": "#/$defs/transportOutcome" },
            "post-message": { "$ref": "#/$defs/transportOutcome" },
            "main-thread": { "$ref": "#/$defs/transportOutcome" }
          }
        }
      }
    },
    "wasmResult": {
      "type": "object",
      "additionalProperties": false,
      "required": [
        "abiVersion",
        "compileAndInstantiateMs",
        "fetchMs",
        "firstCallMs",
        "gzipBytes",
        "mixedValue",
        "rawBytes",
        "strategy"
      ],
      "properties": {
        "abiVersion": { "type": "integer", "minimum": 0 },
        "compileAndInstantiateMs": { "type": "number", "minimum": 0 },
        "fetchMs": { "type": "number", "minimum": 0 },
        "firstCallMs": { "type": "number", "minimum": 0 },
        "gzipBytes": { "type": "integer", "minimum": 0 },
        "mixedValue": { "type": "integer" },
        "rawBytes": { "type": "integer", "minimum": 0 },
        "strategy": { "enum": ["instantiate", "instantiateStreaming"] }
      }
    },
    "wasmBudgetResult": {
      "type": "object",
      "additionalProperties": false,
      "required": [
        "compileAndInstantiateMs",
        "fetchMs",
        "firstCallMs",
        "graphemeCount",
        "gzipBytes",
        "headroomBytes",
        "maximumGzipBytes",
        "productBudgetBytes",
        "rawBytes",
        "strategy"
      ],
      "properties": {
        "compileAndInstantiateMs": { "type": "number", "minimum": 0 },
        "fetchMs": { "type": "number", "minimum": 0 },
        "firstCallMs": { "type": "number", "minimum": 0 },
        "graphemeCount": { "type": "integer", "minimum": 0 },
        "gzipBytes": { "type": "integer", "minimum": 0 },
        "headroomBytes": { "type": "integer" },
        "maximumGzipBytes": { "type": "integer", "minimum": 1 },
        "productBudgetBytes": { "type": "integer", "minimum": 1 },
        "rawBytes": { "type": "integer", "minimum": 0 },
        "strategy": { "enum": ["instantiate", "instantiateStreaming"] }
      }
    }
  }
}
